word,pinyin,translation,word_type
的,de,"possessive, adjectival suffix",particle
一,yī,"one; a, an; alone",numeral
是,shì,"indeed, yes, right; to be; demonstrative pronoun, this, that",verb
不,bù,"no, not; un-; negative prefix",adverb
了,le,to finish; particle of completed action,particle
在,zài,"be at, in, on; consist in, rest",preposition/verb
人,rén,man; people; mankind; someone else,noun
有,yǒu,"have, own, possess; exist",verb
我,wǒ,"our, us, i, me, my, we",pronoun
他,tā,"other, another; he, she, it",pronoun
这,zhè,"this, the, here",pronoun/demonstrative
个,gè,"numerary adjunct, piece; single",measure word
们,men,adjunct pronoun indicate plural,particle (plural marker)
中,zhōng,"central; center, middle; in the midst of; hit (target); attain",noun/preposition
来,lái,"come, coming; return, returning",verb
上,shàng,"top; superior, highest; go up, send up",noun/preposition/verb
大,dà,"big, great, vast, large, high",adjective
为,wèi,"do, handle, govern, act; be",preposition/verb
和,hé,"harmony, peace; peaceful, calm",conjunction
国,guó,"nation, country, nation-state",noun
地,dì,"earth; soil, ground; region",noun/adverb
到,dào,"go to, arrive, been to",verb
以,yǐ,"by means of; thereby, therefore; consider as; in order to",preposition
说,shuō,"speak, say, talk; scold, upbraid",verb
时,shí,"time, season; era, age, period",noun
要,yào,"necessary, essential; necessity",verb/modal verb
就,jiù,"just, simply; to come, go to; to approach, near",adverb
出,chū,"go out, send out; stand; produce",verb
会,huì,"assemble, meet together; meeting",verb/modal verb
可,kě,"may, can, -able; possibly",adverb
也,yě,also; classical final particle of strong affirmation or identity,adverb
你,nǐ,"you, second person pronoun",pronoun
对,duì,"correct, right; facing, opposed",preposition/adjective
生,shēng,"life, living, lifetime; birth",noun/verb
能,néng,"to be able; can, permitted to; ability",modal verb
而,ér,and; and then; and yet; but,conjunction
子,zǐ,"offspring, child; fruit, seed of; 1st terrestrial branch",noun (suffix)
那,nà,"that, that one, those",pronoun/demonstrative
得,dé,"obtain, get, gain, acquire",particle
于,yú,"in, on, at; go to; surname",preposition
着,zháo,"make move, take action",particle
下,xià,"under, underneath, below; down; inferior; bring down",noun/preposition/verb
自,zì,"self, private, personal; from",pronoun (prefix)
之,zhī,"marks preceding phrase as modifier of following phrase; it, him her, them; go to",particle
年,nián,year; new-years; person's age,noun
过,guò,"pass, pass through, go across",verb
发,fā,"issue, dispatch, send out; hair",verb
后,hòu,"queen, empress, sovereign; (simp. for 後) behind, rear, after",noun/preposition
作,zuò,"make; work; compose, write; act, perform",verb
里,lǐ,unit of distance; village; lane,noun/preposition
用,yòng,"use, employ, apply, operate; use",verb
道,dào,"path, road, street; method, way",noun/verb
行,xíng,"go; walk; move, travel; circulate",noun/verb
所,suǒ,"place, location; numerary adjunct",noun
然,rán,"yes, certainly; pledge, promise",particle
家,jiā,"house, home, residence; family",noun
种,zhǒng,"seed; race, breed; to plant",noun/verb/measure word
事,shì,"affair, matter, business; to serve; accident, incident",noun
成,chéng,"completed, finished, fixed",verb
方,fāng,"a square, rectangle; a region; local",noun
多,duō,"much, many; more than, over",adjective/adverb
经,jīng,classic works; pass through,verb
么,yāo,interrogative particle; repetition of a tune small; tender,particle
去,qù,"go away, leave, depart",verb
法,fǎ,"law, rule, regulation, statute; France, French",noun
学,xué,"learning, knowledge; school",noun/verb
如,rú,"if, supposing; as if; like, as",conjunction
都,dū,"metropolis, capital; all, the whole; elegant, refined",adverb
同,tóng,"same, similar; together with",adjective/verb
现,xiàn,"appear, manifest, become visible",verb
当,dāng,"bear, accept, undertake; just",verb/preposition
没,méi,"not, have not, none; drown, sink",adverb
动,dòng,"move, happen; movement, action",verb
面,miàn,"face; surface; plane; side, dimension",noun
起,qǐ,"rise, stand up; go up; begin",verb
看,kàn,"look, see; examine, scrutinize",verb
定,dìng,"decide, settle, fix",verb
天,tiān,"sky, heaven; god, celestial",noun
分,fēn,divide; small unit of time etc.,noun/verb
还,huán,"still, yet, also, besides",adverb
进,jìn,"advance, make progress, enter",verb
好,hǎo,"good, excellent, fine; well",adjective/adverb
小,xiǎo,"small, tiny, insignificant",adjective
部,bù,"part, division, section",noun
其,qí,"his, her, its, their; that",pronoun
些,xiē,"little, few; rather, somewhat",pronoun/measure word
主,zhǔ,"master, chief owner; host; lord",noun/adjective
样,yáng,"shape, form, pattern, style",noun
理,lǐ,"reason, logic; manage",noun
心,xīn,"heart; mind, intelligence; soul",noun
她,tā,"she, her",pronoun
本,běn,"root, origin, source; basis",noun/adjective
前,qián,"in front, forward; preceding",noun/preposition
开,kāi,"open; initiate, begin, start",verb
但,dàn,"only; but, however, yet, still",conjunction
因,yīn,"cause, reason; by; because (of)",conjunction
只,zhǐ,"only, just, simply",adverb
从,cóng,"from, by, since, whence, through",preposition
想,xiǎng,"think, speculate, plan, consider",verb
实,shí,"real, true; honest, sincere",adjective/noun
日,rì,sun; day; daytime,noun
军,jūn,"army, military; soldiers, troops",noun
者,zhě,that which; he who; those who,noun (suffix)
意,yì,"thought, idea, opinion; think",noun
无,wú,"negative, no, not; KangXi radical 71",adjective/adverb
力,lì,"power, capability, influence",noun
它,tā,it; other,pronoun
与,yǔ,"and; with; to; for; give, grant",conjunction
长,cháng,long; length; excel in; leader,adjective/verb
把,bǎ,"hold, take; guard; regard as",verb/preposition
机,jī,desk; machine; moment,noun
十,shí,"ten, tenth; complete; perfect",numeral
民,mín,"people, subjects, citizens",noun
第,dì,"sequence, number; grade, degree",numeral (prefix)
公,gōng,"fair, equitable; public; duke",adjective/noun
此,cǐ,"this, these; in this case, then",pronoun
已,yǐ,already; finished; stop,adverb
工,gōng,"labor, work; worker, laborer",noun
使,shǐ,"cause, send on a mission, order; envoy, messenger, ambassador",verb
情,qíng,"feeling, sentiment, emotion",noun
明,míng,"bright, light, brilliant; clear",adjective
性,xìng,"nature, character, sex",noun
知,zhī,"know, perceive, comprehend",verb
全,quán,"maintain, keep whole or intact",adjective
三,sān,three,numeral
又,yòu,"and, also, again, in addition",adverb
关,guān,frontier pass; close; relation,verb/noun
点,diǎn,"dot, speck, spot; point, degree",noun/verb
正,zhèng,"right, proper, correct",adjective/adverb
业,yè,"profession, business; GB radical 111",noun
外,wài,"out, outside, external; foreign",noun/adjective
将,jiāng,"will, going to, future; general",verb/noun
两,liǎng,"two, both, pair, couple; ounce",numeral
高,gāo,"high, tall; lofty, elevated",adjective
间,jiān,"midpoint, space; place, locality",noun
由,yóu,"cause, reason; from",preposition
问,wèn,"ask about, inquire after",verb
很,hěn,"very, quite, much",adverb
最,zuì,"most, extremely, exceedingly",adverb
重,zhòng,"heavy, weighty; double",adjective/noun
并,bìng,"combine, annex; also, what's more",conjunction
物,wù,"thing, substance, creature",noun
手,shǒu,hand,noun
应,yìng,"should, ought to, must",verb/modal verb
战,zhàn,"war, fighting, battle",noun/verb
向,xiàng,"toward, direction, trend",preposition
头,tóu,"head; top; chief, first; boss",noun
文,wén,"literature, culture, writing",noun
体,tǐ,"body; group, class, body, unit; inferior",noun
政,zhèng,"government, political affairs",noun
美,měi,"beautiful, pretty; pleasing",adjective/noun
相,xiāng,"mutual, reciprocal, each other",adjective/adverb/verb
见,jiàn,"see, observe, behold; perceive",verb
被,bèi,passive indicator 'by'; bedding,particle
利,lì,"gains, advantage, profit, merit",noun/adjective
什,shí,"file of ten soldiers; mixed, miscellaneous",pronoun
二,èr,two; twice,numeral
等,děng,"rank, grade; wait; equal; 'etc.'",noun/verb
产,chǎn,"give birth, bring forth, produce",noun/verb
或,huò,"or, either, else; perhaps, maybe",conjunction
新,xīn,"new, recent, fresh, modern",adjective
己,jǐ,"self, oneself; personal, private; 6th heavenly stem",pronoun
制,zhì,system; establish; overpower,noun/verb
身,shēn,"body; trunk, hull; rad. no. 158",noun
果,guǒ,fruit; result,noun
加,jiā,"add to, increase, augment",verb
西,xī,"west(ern); westward, occident",noun
斯,sī,"this, thus, such; to lop off; emphatic particle",phonetic suffix
月,yuè,moon; month; KangXi radical 74,noun
话,huà,"speech, talk, language; dialect",noun
合,hé,"combine, unite, join; gather",verb
回,huí,"return, turn around; a time",verb/noun
特,tè,"special, unique, distinguished",adjective
代,dài,"replace, replacement (of person or generation); era, generation",noun/verb
内,nèi,inside,noun/preposition
信,xìn,"trust, believe; letter",noun
表,biǎo,"show, express, manifest, display",noun/verb
化,huà,"change, convert, reform; -ize",verb
老,lǎo,"old, aged; experienced",adjective
给,gěi,"give; by, for",verb
世,shì,generation; world; era,noun
位,wèi,"throne; position, post; rank, status; seat",noun/measure word
次,cì,"order, sequence; next",noun/measure word
度,dù,"degree, system; manner; to consider",noun
门,mén,"gate, door, entrance, opening",noun
任,rèn,"trust to, rely on, appoint; to bear, duty, office; allow",noun/verb
常,cháng,"common, normal, frequent, regular",adverb/adjective
先,xiān,"first, former, previous",adjective/adverb
海,hǎi,"sea, ocean; maritime",noun
通,tōng,"pass through, common, communicate",verb/adjective
教,jiào,"teach, class",verb
儿,ér,"son, child; KangXi radical 10",noun/suffix
原,yuán,"source, origin, beginning",noun/adjective
东,dōng,"east, eastern, eastward",noun
声,shēng,"sound, voice, noise; tone; music",noun
提,tí,hold in hand; lift in hand,verb
立,lì,"stand; let stand; establish, set",verb
及,jí,extend; reach; come up to; and,conjunction
比,bǐ,"to compare, liken; comparison; than",verb
员,yuán,"member; personnel, staff member",noun
解,jiě,"loosen, unfasten, untie; explain",verb/noun
水,shuǐ,"water, liquid, lotion, juice",noun
名,míng,"name, rank, title, position",noun
真,zhēn,"real, actual, true, genuine",adjective/adverb
论,lùn,debate; discuss; discourse,noun/verb
处,chù,"place, locale; department",noun/verb
走,zǒu,"walk, go on foot; run; leave",verb
义,yì,"right conduct, righteousness",noun
各,gè,"each, individually, every, all",pronoun
入,rù,"enter, come in(to), join",verb
几,jī,small table,numeral/pronoun
口,kǒu,"mouth; open end; entrance, gate",noun
认,rèn,"recognize, know, understand",verb
条,tiáo,"clause, condition; string, stripe",noun/measure word
平,píng,"flat, level, even; peaceful",adjective
系,xì,"system; line, link, connection",noun/verb
气,qì,"steam, vapor; KangXi radical 84",noun
题,tí,"forehead; title, headline; theme",noun
活,huó,"live, exist, survive; lively",noun/verb
尔,ěr,"you; that, those; final particle",pronoun
更,gèng,"more, still further, much more",adverb
别,bié,"separate, other; do not",verb/adjective
打,dǎ,"strike, hit, beat; fight; attack",verb
女,nǚ,"woman, girl; feminine; rad. 38",noun
变,biàn,"change, transform, alter; rebel",verb
四,sì,four,numeral
神,shén,"spirit, god, supernatural being",noun
总,zǒng,"collect; overall, altogether",adverb/adjective
何,hé,"what, why, where, which, how",pronoun
电,diàn,electricity; electric; lightning,noun
数,shù,"number; several, count; fate",noun/verb
安,ān,"peaceful, tranquil, quiet",adjective
少,shǎo,"few, less, inadequate",adjective/adverb
报,bào,"report, tell, announce",noun/verb
才,cái,"talent, ability; just, only",adverb
结,jié,"knot, tie; join, connect",verb/noun
反,fǎn,"reverse, opposite, contrary, anti",verb/adjective
受,shòu,"receive, accept, get; bear, stand",verb
目,mù,"eye; look, see; division, topic",noun
太,tài,"very, too, much; big; extreme",adverb
量,liàng,"measure, quantity, capacity",noun
再,zài,"again, twice, re-",adverb
感,gǎn,"feel, perceive, emotion",noun/verb
建,jiàn,"build, establish, erect, found",verb
务,wù,"affairs, business; must, should",noun
做,zuò,"work, make; act",verb
接,jiē,receive; continue; catch; connect,verb
必,bì,"surely, most certainly; must",adverb
场,cháng,"open space, field, market",noun
件,jiàn,numerary adjunct for article; matter,noun
计,jì,"plan, plot; strategem; scheme",verb
管,guǎn,"pipe, tube, duct; woodwind music",verb
期,qī,period of time; date; time limit,noun
市,shì,"market, fair; city, town; trade",noun
直,zhí,"straight, erect, vertical",adverb/adjective
德,dé,"ethics, morality, virtue",noun
资,zī,property; wealth; capital,noun
命,mìng,"life; destiny, fate, luck; an order, instruction",noun
山,shān,"mountain, hill, peak",noun
金,jīn,gold; metals in general; money,noun
指,zhǐ,"finger, toe; point, indicate",verb
克,kè,gram; overcome; transliteration,verb
许,xǔ,"allow, permit; promise; betroth",verb
统,tǒng,"govern, command, control; unite",noun/verb
区,qū,"area, district, region, ward",noun
保,bǎo,"protect, safeguard, defend, care",verb
至,zhì,"reach, arrive; extremely, very",preposition
队,duì,"team, group; army unit",noun
形,xíng,"form, shape, appearance",noun
社,shè,"god of the soil and altars to him; group of families; company, society",noun
便,biàn,"convenience, ease; expedient",adjective/adverb
空,kōng,"empty, hollow, bare, deserted",adjective/noun
决,jué,"decide, determine, judge",verb
治,zhì,"govern, regulate, administer",verb
展,zhǎn,"open, unfold; stretch, extend",verb
马,mǎ,horse; surname; KangXi radical 187,noun
科,kē,"section, department, science",noun
司,sī,"take charge of, control, manage; officer",noun
五,wǔ,five; surname,numeral
基,jī,"foundation, base",noun
眼,yǎn,"eye; eyelet, hole, opening",noun
书,shū,"book, letter, document; writings",noun
非,fēi,"not, negative, non-; oppose",adverb/adjective
则,zé,"rule, law, regulation; grades",conjunction
听,tīng,"hear; understand; obey, comply",verb
白,bái,"white; pure, unblemished; bright",adjective/noun
却,què,"still, but; decline; retreat",adverb
界,jiè,"boundary, limit; domain; society; the world",noun
达,dá,"arrive at, reach; intelligent; smooth, slippery",verb
光,guāng,"light, brilliant, shine; only",noun/adverb
放,fàng,"put, release, free, liberate",verb
强,qiáng,"strong, powerful, energetic",adjective/verb
即,jí,"promptly, quickly, immediately",adverb
像,xiàng,"a picture, image, figure; to resemble",verb/noun
难,nán,"difficult, arduous, hard; unable",adjective
且,qiě,"moreover, also (post-subject); about to, will soon (pre-verb)",conjunction
权,quán,"power, right, authority",noun
思,sī,"think, consider, ponder; final particle",verb
王,wáng,"king, ruler; royal; surname",noun
象,xiàng,"elephant; ivory; figure, image",noun
完,wán,"complete, finish, settle; whole",verb
设,shè,build; establish; display,verb
式,shì,"style, system, formula, rule",noun
色,sè,"color, tint, hue, shade; form, body; beauty, desire for beauty",noun
路,lù,"road, path, street; journey",noun
记,jì,"record; keep in mind, remember",verb
南,nán,south; southern part; southward,noun
品,pǐn,"article, product, commodity",noun
住,zhù,"reside, live at, dwell, lodge; stop",verb
告,gào,"tell, announce, inform; accuse",verb
类,lèi,"class, group, kind, category",noun
求,qiú,"seek; demand, request; beseech",verb
据,jù,"to occupy, take possession of; a base, position",noun/verb
程,chéng,"journey, trip; schedule, agenda",noun
北,běi,north; northern; northward,noun
边,biān,"edge, margin, side, border",noun
死,sǐ,die; dead; death,verb
张,zhāng,"stretch, extend, expand; sheet",verb/noun
该,gāi,"should, ought to, need to",pronoun
交,jiāo,"mix; intersect; exchange, communicate; deliver",verb
规,guī,"rules, regulations, customs, law",noun
万,wàn,ten thousand; innumerable,numeral
取,qǔ,"take, receive, obtain; select",verb
拉,lā,"pull, drag; seize, hold; lengthen",verb
格,gé,"pattern, standard, form; style",noun
望,wàng,"to look at, look forward; to hope, expect",verb
觉,jué,to wake up from sleep; conscious,verb
术,zhú,"art, skill, special feat; method, technique",noun
领,lǐng,"neck; collar; lead, guide",verb
共,gòng,"together with, all, total; to share",adverb
确,què,"sure, certain; real, true",adjective
传,chuán,"summon; propagate, transmit",verb
师,shī,"teacher, master, specialist",noun
观,guān,"see, observe, view; appearance",noun
清,qīng,"clear, pure, clean; peaceful",adjective
今,jīn,"now, today, modern era",noun/adverb
切,qiē,"cut, mince, slice, carve",verb/adjective
院,yuàn,"courtyard, yard, court; school",noun
让,ràng,"allow, permit, yield, concede",verb
识,shì,"recognize, understand, know",verb
候,hòu,wait; expect; visit; greet,noun
带,dài,"belt, girdle, band, strap, zone",verb
导,dǎo,"direct, guide, lead, conduct",verb
争,zhēng,"dispute, fight, contend, strive",verb
运,yùn,"run; simplified form of 運 luck, fortune; ship, transport",noun/verb
笑,xiào,"smile, laugh, giggle; snicker",verb
飞,fēi,fly; go quickly; dart; high,verb
风,fēng,"wind; air; manners, atmosphere",noun
步,bù,"step, pace; walk, stroll",noun
改,gǎi,"change, alter; improve, remodel",verb
收,shōu,"gather together, collect; harvest",verb
根,gēn,"root, base(d on); foundation",noun
干,gān,"oppose, offend; invade; dried",adjective/verb
造,zào,"construct, build, make, begin; prepare",verb
言,yán,"words, speech; speak, say",noun
联,lián,"connect, join; associate, ally",verb
持,chí,"sustain, support; hold, grasp",verb
组,zǔ,"class; section, department",noun/verb
每,měi,"every, each",pronoun
济,jì,"help, aid, relieve; ferry, cross",noun
车,chē,"cart, vehicle; carry in cart",noun
亲,qīn,"relatives, parents; intimate the hazel nut or filbert tree a thorny tree",noun/verb/adjective
极,jí,"extreme, utmost, furthest, final",adverb/adjective
林,lín,"forest, grove; surname",noun
服,fú,"clothes; wear, dress",noun/verb
快,kuài,"rapid, quick, speedy, fast; soon",adjective/adverb
办,bàn,"manage, do, handle; deal with",verb
议,yì,"consult, talk over, discuss",noun/verb
往,wǎng,"go, depart; past, formerly",preposition
元,yuán,first; dollar; origin; head,noun
英,yīng,"petal, flower, leaf; brave, a hero; England, English",noun/adjective
士,shì,"scholar, gentleman; soldier",noun
证,zhèng,"prove, confirm, verify; proof",noun/verb
近,jìn,"near, close; approach; intimate",adjective/adverb/preposition
失,shī,"lose; make mistake, neglect",verb
转,zhuǎn,"shift, move, turn",verb
夫,fū,"man, male adult, husband; those",noun
令,lìng,"command, order; 'commandant', magistrate; allow, cause",verb/noun
准,zhǔn,"approve, allow, permit; in accord",verb/adjective
布,bù,"cotton cloth, textiles, linen",verb/noun
始,shǐ,"begin, start; then, only then",verb
怎,zěn,what? why? how?,adverb
呢,ní,interrogative or emphatic final; (Cant.) this,particle
存,cún,"exist, live, be; survive; remain",verb
未,wèi,not yet; 8th terrestrial branch,adverb
远,yuǎn,"distant, remote, far; profound",adjective/adverb
叫,jiào,"cry, shout; hail, greet, call",verb
台,tái,platform; unit; term of address,noun
单,dān,"single, individual, only; lone",adjective/noun
影,yǐng,"shadow; image, reflection; photograph",noun
具,jù,"tool, implement; draw up, write",noun
罗,luō,net for catching birds; gauze,noun
字,zì,"letter, character, word",noun
爱,ài,"love, be fond of, like",verb/noun
击,jí,"strike, hit, beat; attack, fight",verb
流,liú,"flow, circulate, drift; class",noun/verb
备,bèi,"prepare, ready, perfect",verb
兵,bīng,"soldier, troops",noun
连,lián,"join, connect; continuous; even",verb/adverb
调,diào,"transfer, move, change; tune",noun/verb
深,shēn,"deep; depth; far; very, extreme",adjective
商,shāng,"commerce, business, trade",noun
算,suàn,"count, calculate, figure; plan",verb
质,zhí,"matter, material, substance",noun
团,tuán,"sphere, ball, circle; mass, lump",noun
集,jí,"assemble, collect together",noun/verb
百,bǎi,"one hundred; numerous, many",numeral
需,xū,"need, require, must",verb
价,jià,"price, value",noun
花,huā,flower; blossoms,noun/verb
党,dǎng,"political party, gang, faction",noun
华,huá,flowery; illustrious; Chinese,noun/adjective
城,chéng,"castle; city, town; municipality",noun
石,shí,"stone, rock, mineral; rad. 112",noun
级,jí,"level, rank, class; grade",noun
整,zhěng,"orderly, neat, tidy; whole",verb/adjective
府,fǔ,prefecture; prefect; government,noun
离,lí,rare beast; strange; elegant,verb
况,kuàng,"condition, situation; furthermore",noun
亚,yà,Asia; second,noun
请,qǐng,"ask, request; invite; please",verb
技,jì,"skill, ability, talent, ingenuity",noun
际,jì,"border, boundary, juncture",noun
约,yuē,"treaty, agreement, covenant",verb/noun
示,shì,"show, manifest; demonstrate",verb
复,fù,return; repeat; repeatedly,verb
病,bìng,"illness, sickness, disease",noun
息,xī,"rest, put stop to, end, cease",noun
究,jiū,"examine, investigate",verb
线,xiàn,"line, thread, wire; clue",noun
似,sì,"resemble, similar to; as if, seem",verb
官,guān,"official, public servant",noun
火,huǒ,"fire, flame; burn; anger, rage",noun
断,duàn,"sever, cut off; interrupt",verb
精,jīng,essence; semen; spirit,noun/adjective
满,mǎn,"fill; full, satisfied",adjective/adverb
支,zhī,"disperse, pay; support; branch",noun/verb
视,shì,"look at, inspect, observe, see",verb
消,xiāo,"vanish, die out; melt away",verb
越,yuè,"exceed, go beyond; the more ...",verb
器,qì,"receptacle, vessel; instrument",noun
容,róng,"looks, appearance; figure, form",verb/noun
照,zhào,"shine, illumine, reflect",verb
须,xū,"must, have to, necessary",verb/auxiliary
九,jiǔ,nine,numeral
增,zēng,"increase, add to, augment",verb
研,yán,"grind, rub; study, research",verb
写,xiě,"write; draw, sketch; compose",verb
称,chēng,"call; name, brand; address; say",verb
企,qǐ,plan a project; stand on tiptoe,noun
八,bā,"eight; all around, all sides",numeral
功,gōng,"achievement, merit, good result",noun
吗,ma,final interrogative particle,particle
包,bāo,"wrap, pack, bundle; package",noun/verb
片,piàn,"slice, splinter, strip; rad. 91",noun/measure word
史,shǐ,"history, chronicle, annals",noun
委,wěi,"appoint, send, commission",verb
乎,hū,interrogative or exclamatory final particle,particle
查,chá,"investigate, examine, seek into",verb
轻,qīng,"light; easy, simple; gentle",adjective
易,yì,change; easy,adjective/adverb
早,zǎo,early; soon; morning,adjective/adverb
曾,céng,already; sign of past,adverb
除,chú,"eliminate, remove, except",verb
农,nóng,"agriculture, farming; farmer",noun
找,zhǎo,"search, seek, look for; find",verb
装,zhuāng,"dress, clothes, attire; fill",verb
广,yǎn,"wide, extensive, broad; rad. 53",adjective
显,xiǎn,"manifest, display; evident, clear",verb
吧,ba,emphatic final particle,particle
阿,ā,prefix for people's names; used in transliteration,prefix
李,lǐ,plum; judge; surname,noun
标,biāo,"mark, symbol, label, sign; stand the bole of a tree",noun/verb
谈,tán,talk; conversation; surname,verb
吃,chī,"eat; drink; suffer, endure, bear",verb
图,tú,"diagram; chart, map, picture",noun
念,niàn,"think of, recall, study",noun/verb
六,liù,number six,numeral
引,yǐn,"to pull, draw out, attract; to stretch",verb
历,lì,history; calendar,noun
首,shǒu,"head; first; leader, chief; a poem",noun
医,yì,"cure, heal; doctor, medical",noun
局,jú,"bureau, office; circumstance",noun
突,tū,"suddenly, abruptly, unexpectedly",verb
专,zhuān,"monopolize, take sole possession",adjective
费,fèi,"expenses, expenditures, fee",noun/verb
号,hào,"mark, sign; symbol; number",noun
尽,jǐn,"exhaust, use up; deplete",verb/adverb
另,lìng,"another, separate, other",adjective
周,zhōu,Zhou dynasty; circumference,noun
较,jiào,"compare; comparatively, more",adverb
注,zhù,"concentrate, focus, direct",verb
语,yǔ,"language, words; saying, expression",noun
仅,jǐn,"only, merely, solely, just",adverb
考,kǎo,"examine, test; investigate",verb
落,luò,"fall, drop; net income, surplus",verb
青,qīng,"blue, green, black; young",adjective
随,suí,"follow, listen to, submit to",verb
选,xuǎn,"choose, select; elect; election",verb
列,liè,"a line; to arrange in order, classify",noun/verb
武,wǔ,"military; martial, warlike",noun
红,hóng,"red, vermillion; blush, flush",adjective/noun
响,xiǎng,"make sound, make noise; sound",verb
虽,suī,"although, even if",conjunction
推,tuī,"push, expel; push forward",verb
势,shì,"power, force; tendency",noun
参,cān,"take part in, intervene; ginseng",verb
希,xī,"rare; hope, expect, strive for",noun
古,gǔ,"old, classic, ancient",adjective
众,zhòng,"multitude, crowd; masses, public",noun
构,gōu,"frame, building, structure",verb
房,fáng,"house, building; room",noun
半,bàn,half,noun
节,jié,"knot, node, joint; section",noun
土,tǔ,"soil, earth; items made of earth",noun
投,tóu,"throw, cast, fling, pitch; jump",verb
某,mǒu,certain thing or person,pronoun
案,àn,"table, bench; legal case",noun
黑,hēi,"black; dark; evil, sinister",adjective
维,wéi,"maintain, preserve, safeguard",verb
革,gé,"leather, animal hides; rad. 177",noun/verb
划,huá,to row or paddle boat; to scratch,verb
敌,dí,"enemy, foe, rival; resist",noun
致,zhì,"send, deliver, present; cause",verb
陈,chén,"exhibit, display; plead; a surname",noun
律,lǜ,"statute, principle, regulation",noun
足,zú,"foot; attain, satisfy, enough",noun/adjective
